{
  "$schema": "https://json-schema.org/draft/2020-12/schema",
  "$id": "https://github.com/devploit/php2shell/blob/main/profiles/schema.json",
  "title": "PHP2Shell build profile",
  "description": "Per-build profile with libphp offsets, heap calibration parameters and RCE verification status.",
  "type": "object",
  "required": [
    "name",
    "php_version",
    "branch",
    "sapi",
    "arch",
    "rce",
    "libphp",
    "stages",
    "config"
  ],
  "properties": {
    "name": {
      "type": "string",
      "pattern": "^php-[0-9]+\\.[0-9]+\\.[0-9]+-",
      "description": "Unique profile identifier: php-<version>-<distro>-<arch>."
    },
    "php_version": {
      "type": "string",
      "pattern": "^[0-9]+\\.[0-9]+\\.[0-9]+$",
      "description": "Exact PHP version, e.g. 8.4.26."
    },
    "branch": {
      "type": "string",
      "pattern": "^[0-9]+\\.[0-9]+$",
      "description": "PHP release branch, e.g. 8.4."
    },
    "fixed_in": {
      "type": [
        "string",
        "null"
      ],
      "description": "First patched version in this branch, or null for EOL branches."
    },
    "sapi": {
      "type": "string",
      "enum": [
        "apache2handler",
        "fpm"
      ],
      "description": "Server API: apache2handler (mod_php prefork) or fpm (nginx + PHP-FPM)."
    },
    "verified": {
      "type": "boolean",
      "description": "Whether the profile has been tested against a real target."
    },
    "rce": {
      "type": "boolean",
      "description": "True only when a real command proof (uid=...) was obtained."
    },
    "upstream_profile": {
      "type": "string",
      "enum": [
        "bookworm",
        "bookworm-noexpose",
        "lab"
      ],
      "description": "Upstream exploit profile name passed to exploit.py."
    },
    "distro": {
      "type": "string",
      "description": "Target distribution, e.g. debian, ubuntu, alpine."
    },
    "arch": {
      "type": "string",
      "enum": [
        "aarch64",
        "amd64"
      ],
      "description": "CPU architecture."
    },
    "libphp": {
      "type": "object",
      "description": "Symbol offsets relative to the libphp.so load base (apache2handler) or the php-fpm PIE base (fpm).",
      "required": [
        "zif_system",
        "zval_ptr_dtor"
      ],
      "properties": {
        "zif_system": {
          "type": "string",
          "pattern": "^0x[0-9a-fA-F]+$",
          "description": "Offset of zif_system (the C handler behind PHP's system())."
        },
        "zval_ptr_dtor": {
          "type": "string",
          "pattern": "^0x[0-9a-fA-F]+$",
          "description": "Offset of zval_ptr_dtor (the destructor the stage-3 hijack replaces)."
        },
        "htdata": {
          "type": [
            "string",
            "null"
          ],
          "pattern": "^0x[0-9a-fA-F]+$",
          "description": "Chunk-relative offset of the 167-byte live string used as stage-3 carrier. Null when stage 3 is not calibrated."
        }
      },
      "additionalProperties": false
    },
    "fpm": {
      "type": "object",
      "description": "PHP-FPM stale-BG(unserialize) chain layout (lab-calibrated; offsets relative to the php-fpm PIE base).",
      "properties": {
        "basic_globals": {
          "type": "string",
          "pattern": "^0x[0-9a-fA-F]+$",
          "description": "Offset of basic_globals in the php-fpm binary."
        },
        "bg_unserialize_data_off": {
          "type": "integer",
          "description": "offsetof(php_basic_globals, unserialize.data)."
        },
        "bg_unserialize_level_off": {
          "type": "integer",
          "description": "offsetof(php_basic_globals, unserialize.level)."
        },
        "struct_size": {
          "type": "integer",
          "description": "sizeof(struct php_unserialize_data) for this build."
        },
        "reclaim_pads": {
          "type": "array",
          "items": {"type": "integer"},
          "description": "Pad field sizes placed before the big reclaim field."
        },
        "reclaim_size": {
          "type": "integer",
          "description": "Size of the big multipart field that reclaims the stale struct."
        },
        "oracle": {
          "type": "string",
          "description": "Calibration oracle used by the lab client (e.g. /proc/<pid>/mem)."
        },
        "no_oracle": {
          "type": "object",
          "description": "HTTP-only endgame geometry: no /proc/<pid>/mem is read at exploit time.",
          "properties": {
            "reclaim_pads": {
              "type": "array",
              "items": {"type": "integer"},
              "description": "Pad field sizes placed before the big reclaim field."
            },
            "reclaim_size": {
              "type": "integer",
              "description": "Size of the big multipart field that reclaims the stale struct."
            },
            "candidates": {
              "type": "array",
              "description": "Candidate (d offset, cover offset) pairs tried in order.",
              "items": {
                "type": "object",
                "properties": {
                  "d_off": {
                    "type": "string",
                    "pattern": "^0x[0-9a-fA-F]+$"
                  },
                  "k": {
                    "type": "string",
                    "pattern": "^0x[0-9a-fA-F]+$"
                  }
                },
                "required": ["d_off", "k"],
                "additionalProperties": false
              }
            },
            "bases": {
              "type": "string",
              "description": "How the absolute bases are supplied or derived."
            }
          },
          "additionalProperties": false
        },
        "leak": {
          "type": "object",
          "description": "HTTP-only base leak geometry (stale short-session string OOB read).",
          "properties": {
            "arm_path": {
              "type": "string",
              "description": "Builder script that stores the large stale session values (for example /bigvar.php)."
            },
            "pads": {
              "type": "array",
              "items": {"type": "integer"},
              "description": "Field sizes placed before the reclaimed forged header."
            },
            "size": {
              "type": "integer",
              "description": "Reclaim buffer size in bytes."
            },
            "header_content_off": {
              "type": "string",
              "pattern": "^0x[0-9a-fA-F]+$",
              "description": "Offset of the forged zend_string header inside the reclaim content."
            },
            "read_len": {
              "type": "string",
              "pattern": "^0x[0-9a-fA-F]+$",
              "description": "Forged string length that spans the stale chunk and PIE pointers."
            },
            "chunk_ptr_off": {
              "type": "string",
              "pattern": "^0x[0-9a-fA-F]+$",
              "description": "Offset of the stale zval chunk pointer in the leaked bytes."
            },
            "chunk_base_off": {
              "type": "string",
              "pattern": "^0x[0-9a-fA-F]+$",
              "description": "Offset from the chunk pointer to the Zend-MM chunk base."
            },
            "pie_ptr_off": {
              "type": "string",
              "pattern": "^0x[0-9a-fA-F]+$",
              "description": "Offset of the leaked execute_ex handler pointer in the leaked bytes."
            },
            "pie_base_off": {
              "type": "string",
              "pattern": "^0x[0-9a-fA-F]+$",
              "description": "Offset from the leaked execute_ex handler pointer to the PIE base."
            },
            "bases": {
              "type": "string",
              "description": "How the bases are obtained."
            }
          },
          "required": [
            "arm_path",
            "pads",
            "size",
            "header_content_off",
            "read_len",
            "chunk_ptr_off",
            "chunk_base_off",
            "pie_ptr_off",
            "pie_base_off"
          ],
          "additionalProperties": false
        }
      },
      "additionalProperties": false
    },
    "stages": {
      "type": "object",
      "description": "Heap calibration parameters for each exploit stage.",
      "properties": {
        "stage1_n": {
          "type": ["integer", "null"],
          "minimum": 1,
          "description": "Number of multipart fields to place before the forged block in stage 1. Null when not calibrated."
        },
        "stage1_forge_len": {
          "type": ["integer", "null"],
          "minimum": 1,
          "description": "Byte length of the forged zend_string block in stage 1. Null when not calibrated."
        },
        "stage2_t": {
          "type": ["integer", "null"],
          "minimum": 1,
          "description": "Target field index for the stage-2 libphp pointer leak. Null when not calibrated."
        },
        "stage2_v": {
          "type": ["integer", "null"],
          "minimum": 1,
          "description": "Value parameter for stage-2 calibration. Null when not calibrated."
        },
        "stage3_pads": {
          "type": [
            "array",
            "null"
          ],
          "items": {
            "type": "array",
            "items": {
              "type": "integer"
            },
            "minItems": 2,
            "maxItems": 2
          },
          "description": "Padding pairs for stage-3 heap grooming. Null when stage 3 is not calibrated."
        },
        "stage3_carrier": {
          "type": [
            "boolean",
            "null"
          ],
          "description": "Whether the 167-byte carrier string is used. Null when stage 3 is not calibrated."
        }
      },
      "additionalProperties": false
    },
    "config": {
      "type": "object",
      "description": "Target runtime configuration used during calibration.",
      "properties": {
        "memory_limit": {
          "type": "integer",
          "description": "PHP memory_limit in bytes, or -1 for unlimited."
        },
        "display_errors": {
          "type": "string",
          "description": "display_errors setting and how it was determined."
        },
        "session_upload_progress": {
          "type": "string",
          "description": "session.upload_progress.enabled value."
        },
        "workers": {
          "type": "integer",
          "minimum": 1,
          "description": "Number of Apache prefork workers."
        }
      },
      "additionalProperties": false
    },
    "measured": {
      "type": "object",
      "description": "Addresses observed during calibration (informational, not used at runtime).",
      "properties": {
        "chunk_base": {
          "type": ["string", "null"],
          "pattern": "^0x[0-9a-fA-F]+$",
          "description": "Zend MM chunk base address from stage-1 leak. Null when not leaked."
        },
        "libphp_base": {
          "type": ["string", "null"],
          "pattern": "^0x[0-9a-fA-F]+$",
          "description": "libphp.so load base from stage-2 leak. Null when not leaked."
        },
        "chunk_base_example": {
          "type": ["string", "null"],
          "pattern": "^0x[0-9a-fA-F]+$",
          "description": "Example chunk base observed on a similar build (informational)."
        },
        "libphp_base_example": {
          "type": ["string", "null"],
          "pattern": "^0x[0-9a-fA-F]+$",
          "description": "Example libphp base observed on a similar build (informational)."
        },
        "stage3_http_session_vars": {
          "type": ["string", "null"],
          "description": "Chunk-relative shape of $_SESSION storage observed during calibration."
        },
        "stage3_ref_buffers": {
          "type": ["string", "null"],
          "description": "Chunk-relative shape of the reference buffers observed during calibration."
        }
      },
      "additionalProperties": false
    },
    "status": {
      "type": "string",
      "description": "Human-readable calibration result summary."
    },
    "oom_mb": {
      "type": "integer",
      "minimum": 1,
      "description": "OOM body size in MiB passed to the upstream exploit."
    },
    "oom_margin_mb": {
      "type": "integer",
      "minimum": 1,
      "description": "Margin above memory_limit used to trigger OOM."
    },
    "memory_limit_tested_mb": {
      "type": "array",
      "items": {
        "type": "integer",
        "minimum": 1
      },
      "description": "memory_limit values (in MiB) where RCE was verified."
    }
  },
  "allOf": [
    {
      "if": {
        "properties": {
          "rce": {
            "const": true
          },
          "sapi": {
            "const": "apache2handler"
          }
        },
        "required": ["rce", "sapi"]
      },
      "then": {
        "required": [
          "oom_mb"
        ],
        "properties": {
          "libphp": {
            "required": [
              "zif_system",
              "zval_ptr_dtor",
              "htdata"
            ],
            "properties": {
              "htdata": {
                "type": "string"
              }
            }
          },
          "stages": {
            "required": [
              "stage1_n",
              "stage1_forge_len",
              "stage2_t",
              "stage2_v",
              "stage3_pads",
              "stage3_carrier"
            ],
            "properties": {
              "stage3_pads": {
                "type": "array"
              },
              "stage3_carrier": {
                "type": "boolean"
              }
            }
          }
        }
      }
    },
    {
      "if": {
        "properties": {
          "rce": {
            "const": true
          },
          "sapi": {
            "const": "fpm"
          }
        },
        "required": ["rce", "sapi"]
      },
      "then": {
        "required": [
          "oom_mb",
          "fpm"
        ],
        "properties": {
          "fpm": {
            "required": [
              "basic_globals",
              "struct_size",
              "reclaim_size"
            ]
          }
        }
      }
    }
  ],
  "additionalProperties": false
}